{
  "schema_version": 1,
  "status": "passed",
  "validation_level": "l3",
  "execution_backend": "local",
  "attempts": 1,
  "accuracy": {
    "pass": true,
    "atol": 0.0001,
    "rtol": 0.0001,
    "max_diff": 0.00001
  },
  "artifacts": {
    "fixed_code": "KernelGen/step6_test_code_fix.py",
    "report": "KernelGen/step6_test_code_fix.md"
  },
  "failure_reason": null
}
